764,Kabhi Soti hui Ladki ke Pom Pom dabay He Typing
765,8 Nali ho Typing
766,Sach batao raat Me kitni Baar le Ek Sakte ho Typing
767,Abhi Aapne Kis colour X Bra peheni he SDD Typing
768,Kabhi Calti se Bina kapdc Ke dekha he Typing
769,Sach batana Kitni Age me First time Kiya tha Typing
770,Sach l batana Kia kabhi Gan Mari he 840 Typing
771,Ladkio 8 Kia kabhi Niche chocolate lagakar Chatvaya He Typing
772,Mein Ladko Ek choE ho Kitne lanDal sakte DO Typing
773,batao Boys Abhi tak ki Seel todi he DB tno Typing
774,rakhaTh OyO OyO Laga paya Bhi nai Tik mint 50
775,Dalne Se matlab Rakho Gulabi ho Ya kaali OU Typing
776,bolna Jhut mat pat Baal Aapko Ch nai Pasand he Ya BAUO Typing
777,Sach batana Kabhi 2 Behno ko Ek sath Pela he Typing
778,ach batana Kon kon irgin he Typing
779,Boys Bolo kiss Karoge Par karni Lekin chu DD Hogi Typing
780,yar karo Usi se Jo hate ch saari Raat KDROUED Typing
781,Girls batao Raat me Sone Se pehle Ungli Karti ho Typing
782,Jhut mat bolna Kia Kabhi L n kaPani Piya he t Typing
783,Kia Aapne kabhi Live Chuai Dekhi he PDS Typing
784,Jhut mat bolna Kabhi Gd me Me pani Giraya he Typing
785,Sachi batana Kitne Din se E kks nai Kiya Typing
786,Kia Karne parr khade Khade He Dard hota me Sach Koi mujhe bhi bata do
787,Apne I_n Mujhe Kia aap ho bhej Sakte pa pic b Typing
788,Se Clour ki Panty kon Aaj he Paheni Typing
789,Ka moka Doo chatne Me chatoge To kaha piche Aage Typi
790,bolna Jhut mat kitne Round Full night Me ho DD 22 Le sakte Typing
791,Me Kitne year Batao 8 hua girna Shro Pani Typing
792,bolna Jhut mat Karne me Condmlagakar Maza aata He ya Bina Condm ke Typing
793,Ladkio sach batand Tumhara kitni Der me Pani Nikalta he Typing
794,Jhut mat bolna Kia aapki Ch Par bhi Baal he Typing
795,Acha batao Karne me bs Bade he 690 Aapke hath Kiska Typing
796,ladko Sonu Samay tumhe 34 chat te Badbo nahi aati Typing
797,ine Aqpko pn Kisi Jhut nai bolna Typing
798,Chusne me Kia ladkio he aata Maza Typing
799,Yarr galti se mene apne dust ka ln dekh liya Ab kia hoga
800,Or batao Kab betha rahe ho apne lan parr Typing
801,kia ye sach he ladko ka Sab kala hota he Typing
802,Chalo batao round kitne time Pehla hona chahiye ka Typing
803,si 2 position ladkio Kon ko pasand he Typing
804,Jhut mat bolna Kabhi bestfriend ki ch mari he 0 Typing
805,Girls batao si chiiz achi Boys ki kon lagi he EE Typing
806,Or batao Aapke ln ka size kia he Typing
807,Jhut mat bolna ladkia apne bs Kia aap Dabati he apne Typing
808,Kia aapka kabhi Night fall hua he Typing
809,Jhut mat bolna me lene se Lodkia gad kio darti he Typing
810,mujhe apna aap Kia kar pic send ka Ln ho sakte
811,Sach batana Aapne sabse pehle kiska ln dekha Batao
812,Meri back kaisi lagi Typing
813,Kabhi bestfriend ko pilay he Bbs Batao
814,Or batao boys Batao
815,Sach batana Tum apni ich Me kon Si Ungli dalti ho EE Batao
816,Sonu ladko
817,Yarr aaj sote time mera White white nikal gya 89
818,Kia ye sach he ki Sab ladko ka Ien kala hota he Ty
819,Jhatka deker karne me Maza aata he ya dheere se Batao
820,Sach batana Uchli ho Bata
821,Mere ghar wale kehte he Ki waqt se pehle jawan Ho gai Aisa kio kehtehe
822,Batao
823,Batao kitne round maroge Jo me roo jao Batao
824,Agar me tumhe ek din ke Liye room me mil jao to Typing
825,Suna he aapka ln he kia ye baat sach He Teda DEE K Batao
826,Jhut mat bolna Kabhi kisi ka moh Me ld liya he U Batao
827,Acha batao Chedd Aage wali me kitne Hote he Batao
828,Jhut mat bolna a kaha Karne me Jayada maza he aata Maza Aage Peeche Batac
829,Girls batao Kia bs dabwane se Dard hota he Batao
830,batao Girls mood Banta he aapka Jab ho To kia karte Batao
831,Koi jhut nai bolega Kia aapne kabhi kisi ki Seel I todi he Batao
832,Acha bataoa first time karne parr Kaisa lagta he Batc
833,Jab aapka pehli bar Pani Nikla tha to kaisa Laga Tha X Batao
834,Masal masal kar Khada Kiya Thook laga kar Ghusa Diya Batao kia he
835,r kisi ka mohh me Yarr Lene ka mann kar raha he 90U Kia kro
836,i ladki ki panty Kabhi kisi Sunghi he Batao
837,Nind aa rahi he to Meri me dalkar so jao
838,k aisa game Batao Jisme ladka Dalta he Or ladki dalvati heo Batao
839,Marne me he Ch Asli maza mutthi a Batao
840,Kia aapne Kabhi Kisi ka Lan Pakda he Batao
841,irls t batao ab aapka Mood banta Banta de tokia Karte ho Batao
842,Kia ladkio Ka bhi Night fall Hota heDi Batao
843,Sach batana Kia Aapne kabh pen bs Dekhe he Batao
844,Chalo sab Apni apni Aadat Likho Mujhe to roz Lan Lene
845,Jhut matt bolna Kia bs Dabane par Dard Hota he Batao
846,bolna hut mat Kia aapko Lan Chusna Ihe K Pasand Batao
847,Jhutt bada Ladko ka Sabse DD se Daloga Baby aaram
848,Kia me aapka La Dekh sak Ho 9000 2 Batao
849,batand Kitne round Sach Jhell loge Me 8 round
850,Batao
851,aaj kal Ke Kia batana Sach Round d me thakk 1 hi Ladke he Jate Batao
852,kitna Bada he Aapka 90 Sach batand Batao
853,Khada dekhkar Bhai ka kar Leti ho Fingering
854,Vo he jisko ka Masoom to 69 matlab Nahi Ka i pata Aapko pata he
855,0 3 round Ke bad bhi Nai Rukta vo Entry kare 049 He koi
856,round me halo bataoKitne doge Rula Batao
857,Ladkio ka Sabse bada Jhut pato He he kia Baby dard ho raha he 0
858,He dekhte Bache to orimon Pom pom tumhe me Aao E 98 Dikhao
859,Aapne kabhi MuhMe Liya he Jhut nai bolna Batao
860,batao Acha kitneRound Me night 94 Full ho sakte Laga Batao
861,Sach batana Kon si Age Me first time Kiya tha BataO
862,Sach batana Last Bar Kab Ghapa ghap Kia Thao Batao
863,Sach batana Kaha Par Kiss karne Se maza Aata he K Batao
864,Sach batana Aap Ho na 88 Hilate Batao
865,Kabhi galti se Kisi ko Bina Kapdo ke Dekha he Batao
866,halo batao Aapke niche ala black He ye pink K Batao
867,batana ach Karne par time First He lagta Kaisa Batao
868,Sach batao Aapne first Time Kiske Sath kia tha Batao
869,h batana Toilet Me ya he e Batao
870,Sach batana Kabhi kisi Ka pakda He 2 Batao
871,Ek baat batao t Mene fingre Aaj raat liya Kar
872,Yarr Bestfreind Ke sath Seks ka Sakte he I need a bestfriend
873,Kia aapko Hilana Pasand He Batao Anshusharma546
874,Apne Bestfriend Ke sath kar Sakte ho Seks Batao
875,uestion for boys Hote Kitne time Me discharge Ho Batao Anshusharma546
876,Sach batana tni garmi Me bra Pahenti Ho Batao Anshusharma546
877,Question for girls Kitna mota Jhel Sakti HO BataO
878,Sach batana Aapke Ke baal Aqye Niche Batao Anshusharma546
879,Sks karne ki Kon si Age Sahi hoti I he Batao Anshusharma546
880,Sach batand Pehle Round Me kitne Tik sakte ho Batao Anshusharma546
881,Kabhi apni Friend Ke sath Kia he in A Batao Anshusharma546
882,for girls Question Kia ladkio Ka bhi Night fall Hota he K WAW Batao Anshusharma546
883,Ek baat batao bhabiyo Me hi he Maza Batdo Anshusharma546
884,Sach batana Kabhi apne Bhai ka Dekho He Batao Anshusharma546
885,Sach batana Dalwaya Kabhi piche se He 0 Batao Anshusharma546
886,Sach batana Karti ho Kitni ungli Use Batao Anshusharma
887,Sach batana First round Kitne Time tak chalna chahiye Bolo
888,Koi batayga 7 Oyo Me kia Hota he Batao Anshusharma
889,Sach batand ke Baal Kia Niche age me X 804 Aaye Batao Anshusharma
890,arr mere wale Ka chota He Bahut Kia kro Anshusharma546
891,Kia sab Ladko ka Teda Hota he BataO Anshusharma546
892,nai bolna Jhoot clour ki BraPahen rakhi Kis He 0 Batao Anshusharma546
893,Sach batana Kabhi kisiLadke ka Ka Dekha he Batao Anshusharma546
