361,adka kitna bhi ahdCR kio Na ho Mujh jaisi ladki usko frld Ke rakh Degi Ganshusharma546
362,Ke baad bhi piche se zc ker dene Wali ladkio parr kabhi Shaqq mat Karna anshusharma546
363,Sacha pyaar wo nahi jisme Dil Tot jaay Sacha pyaar wo he jisme Palang Tot jaay anshusharma546
364,Aurat par gussa karoge to TEIlT KholegiQ Pyaar karoge to TnT Kholegi Canshusharma546
365,plleB sab 9 inch walaDekhti he chodti 4 inch ka bhi nahi anshusharma546
366,Aurat jab Fairness cream Lagati He to pure chehre parr frar Aata he Jab mard ki cream ander Leti he to Pure 2rz par nikhar aataHe anshusharma546
367,GWOT frestaurant Agar mard aurat ko r Me khana khila raha he to bajayga Bhi Hotel ke room me anshusharma546
368,alentin day par jinn ladko Ko unka yaar nahi mila unka Dil tota hoga r jinn ladkio ko pyar mila Hoga unki el tot Hogi anshusharma546
369,af agar jhagda kare to Usspar Hath nahi uski Tanit Uthao gel rahegi anshusharma546
370,x Me usse chicl ch43 pahenKar boli Kaisi lag rhi ho Phir mujhe chys dubara Pahenne Pade
371,Aaj baat to karni he Parr karni he ifwali anshusharma546
372,sl4gi ke ξa nahi hote Phir bhi dil Kaat lete he Lete he anshusharma546
373,icjTagar bhabi se ho to Mann kabhi Nahi bharta anshusharma546
374,Orat sab koch bhool sakti He parr dene Wale ko nai Pehli baarTyrg Bhool sakti 100 anshusharma546
375,2 Chd hone ka baad bhi Log M me dena pasand karte He aisa kio yarr
376,He 14th Feb ko dogi na Me Ha lekin aaram se anshusharma546 time ki baat ho rhi he
377,Sache mard orto ki gili Karte He Unki aankhe nahi c Anshusharma546
378,Orkoi g3ifer nahi he meri Bas thoda Lipta lipti Ho jati to sara kaam apne aap hi Ho jata Canshusharma546
379,Pyaar bina chain kaha re Or chain khole bina pyaar kaha he Ganshusharma546
380,ElsT agar manpasand ho to aFIT Ya yc Ki jarurat nahi padti zxalyll khud pani chud deta He use Ander lene ke liye Anshusharma546
381,Bhabio kicd3dminaaro Par Chadne ke liye Tumhare pass bhi ct ct khambe Hone chahiye anshusharma546
382,Bhabio ka pyaar Tct ke jaisa Hota he 5xT bhi rehta he Or 5E me bhi Rehta he anshusharma546
383,Suna he 3ny studies me ci6a Week He 4 thFeb ko extra classricl TRIT anshusharma546
384,gar shadisuda orat apke Aas ass aa rahi he to wo 3Ir uT3 hahti he anshusharma546
385,0 se jyada behter 40 Hoti he uality Quantity Experienced anshusharma546
386,abse mazedar smbhoTab shro Hota hein jab mard thak Jaay orr Orat khud jhatke lagaay Canshusharma546
387,rat ko agar kaabu me Rakhna he o sir par nahi balki Apne bekabu le par betha kar rkhoo anshusharma546
388,Aapko pata he Naya naya driver gadi kam Chalatz He or horn jayada bajata he Canshusharma546
389,Bahut orto ko kisi iz ke lshq me tme to Pighalte dekha ha kisi ko simeu Kisi ko mul me hilte dekha he Canshusharma546
390,Har aorat ko acha lagta he Sajna Sawarna or phir jor jorSe bajna anshusharma546
391,Orat sabse jayada kharach apne chust par karti he Or usse bhi jayada enjoy bina kapdo ke karti he anshusharma546
392,mard apni pasandida Orat ko nai balki apne Ghde par par dhana pasand karte he Canshusharma546
393,Ia mood banane wala Hona chahiye Ife4r to me khud bana longi Canshusharma546
394,Bijli ke taar or ladki me Koi fark Nahi he uno ringe ho jaay to jaan Nikaal Dete he anshusharma546
395,Dunia me sabse Takatwar he Jibh Galat chal jaay to hatiyar Chal jate He Or vaha chal jati he to tng uth jati heoo anshusharma546
396,ach pyar wo nai jisme dil Tote ach pyaar wo he jisme Palang tote anshusharma546
397,gar maintenance achi ho To rani mrt bhi acha kaam Karti he anshusharma546
398,Sara f 2 bond ka he Ek bahar nikalne ke liye Taras rhi he Dusti ander lene ke liye Taras rhi h anshusharma5461
399,d chahe kitna bhi Takatwar Kio naho tusko1me nichodDeti He Canshusharma546
400,Pehele mujhe koi nai rula Sakta tha Phir mene BF bana lia ab woroj rat ko rulata he Canshusharma546
401,Jab duno taraf aag lagi ho Tab ye Pata nai chalta ki kitna Ander h Canshusharma546 Kitnabaharh
402,Jis mahilc ko ziit ka Chaska lag Jata he Usko dhund me bhi andhaDhund Karbane ka mann karta he anshusharma546
403,3ciul ka sabak unn Ladkio Se pochiye jinke pati ka 2 Mjnt m Nkl jata he anshusharma546
404,zi leti ho to uske DcK lene ka Lene kaThaf Canshusharma546
405,Orat jisko chahe uske lie Apne Aage piche duno darwaje Khol Deti he anshusharma546
406,ki zindagi he or usme Bhi h keh deta h ki aajNai loga0o anshusharma546 thoda samjha kar yarr
407,Orat itni najuk he ki choti Si soi Se darr jati he a Or bahadur itni he ki bade Se bada Apne ander le sakti he Canshusharma546
408,Sabko shadi suda orat Pasand he Kioki kitne bhi tej jhatke Maro Chillati kam he or 3craf Jayada He anshusharma546
409,H I bada hoga soch karUdas tha Rat me bada Ch delhker Khush Ho gya anshusharma546
410,Roothna orto ka fimrz hota He or thui orat ki Tn_g Apne kandho Per rakhkr usko mananaMard ka eierq hota he anshusharma546
411,Canshusharma546 NAHI Vijha se S tt_ DIL Kosis bas itni si rakho ki Apki
412,r par Bhaiya ne pucha Tum call Per roo kio rahi thi unhe kon batay ki Bf Piche se PL rha tha Anshusharmas4c
413,Mard ka gussa thanda Karne ke Liye orat khud garam ho Jati He100 anshusharma546
414,Aksar vahi Irki sahi se Karwati He jo shro me bahut jayada trcch karti he anshusharma546
415,Din me chahe kitna bhi Kadak ayd6R ho raat me Sab koch Ct te he larkee anshusharma546
416,bar larki ne 35 ki umar Paaar arli to use 3rjefa mard se Jayada Zam umar ke larko me nterest hone lagta he anshusharma546
417,Ishq me marjia nai chalti Kiina bhiMtC ho lena padtahe Canshusharma546
418,Bol rha tha Im so strong Apni ek ud pic send kardi ap hila2 kar kamjor ho gya anshusharma546
419,Patli pin wali larkia bhi Ajkl Mota charger thokne wlaa Dhund rhi he anshusharma546
420,Otrat kabhi bhi apne Pasndida Mard ke samne Gd Banne me nai Sharmati he GanshusharmaS4
421,at sabse jayada kharchKapdo Per karti he Orr usse bhi jayada bina kopdo ke karti he anshusharma546
422,Aurat ne sirf apne Pasndida Mard ki 3sri Tang khichi He Canshusharma546
423,Orat ko mrna jurm he or Orat ki naa marna usse bi bada jurm he anshusharma546
424,Mohabbat me Gl Nai mari jaati G GL Khaker mari jati he Canshusharma546
425,Dunia ke 3 sabse khubsoorat shabd Achababakarlo anshusharma546
426,chicken aise banao ki kacha na ho Mohabbat aise nibhao ki Bch na ho anshusharma5461
427,Sabki apni apni qismat he Sahab Koi marke sota he koi marke sota he anshusharma546
428,Mard ke hathiyar me dam hona chahiye Kioki jab bistar par jangHoti he to Jeet uske hathiyar par Depend Karti he anshusharma546
429,Kamar patli or Pchda choda karne ke liye Kai ghodo ki savari kerni padti he anshusharma546
430,Orat kitni bhi Najukkomal body wali kio na ho Use mard sirf sakht hatiyar or jordar jhatko wala hi pasand aata he anshusharma546
431,Biwi aisi honi chahiye jo Khud Kahe tum nai loge to me khud dogi anshusharma546
432,Idhar me bacho ke name soch rhi thi Udhar wo th marker bache west kar rha tha anshusharma546
433,Daru ki dukan or padosan Ki g_ Mard ko hamesha apni or Akarshi Krti he anshusharma546
434,3rerfaorte hamesha apne medan ko saaf rakhti he Kioki unhe pata hota he ki khiladi labhi bhi khelne aa sakta he anshusharma546
435,Aaj ka gyaa Relationship me time dena orr time se dena bahut jarori he Canshusharma546
436,Aajkal ladkio ko sachi Mohabbat Nai balki achi tarha se Ctne or Ctsne wala chahiye Canshusharma546
437,Aajkal ladkio ko ladko se Koch nai Chahiye sivay unke Nnno keo anshusharma546
438,Ladkia bolne me sharmati He Werna itni thand me bina L_ ke Nind nai aati anshusharma546
439,Sorry bol deta ho phir De Degi pehle de deti ho bad Me Maan jayga Canshusharma546
440,faarg ke 2 trut hote he Din me swaha or raat me Ahaa anshusharma546
441,hand me kitna bhi heeter Jala lo lism ki garmi to smbog Karne se Jaygi its_janvi0909
442,adki or dhol tab awaj sahi Karte he ab usko bajane wale ka Danda Majbot ho anshusharma546
443,Mohabbat me shiddat or Jhatko me Takat ho to Wo hamesha apne mard ke Liye 100 Gulam rehti he Canshusharma546
444,Aajkal adhed umar ki orto ki pehli pasand hoti he T7Nojawan ladke anshusharma546
445,Kabhi GndBate bhi karr leni chahiye depression khatam hojatahe Canshusharma546
446,Agar banda smart ho to Gd Banne me kaisi Sharam Ganshusharma546
447,ehle jo Dood pine se darte Th b wo Dood dekhne ke liye Taraste he anshusharma546
448,UTTZIRIUT Niraash mat hoiyeItihas Gavah he Dusra rnd pele rod se Lamba chalta He anshusharma546
449,Subah ke yog se nahi balkiRaat ke Smbh se shareer fit rehta he anshusharma546
450,Sindoor dekhkar piche mat Hatna Kioki Licenses Gun bhi chori ho Jati he 100 Canshusharma546
451,Sambg ke doraan moh se Nikalne wali Siskia Mard ke liye Sangeet ke 7 zax ka aand deti he anshusharma546
452,9 Me Rok pagal kapde to utr loo anshusharma546
453,Mera picha mat karo se leker Piche karo tak ka safar hi mohabbat he anshusharma546
454,Jarori nahi ki her koi relationship me rhe Koch log friend with benefits me bhi rehte he anshusharma546
455,Kehte he ko orat ke hath mejaadu hota he Tabhi to 2 inc ke saman ko 7 n kar deti he anshusharma546
456,Bol raha tha depressed feel ho rha he Phir mene apni Nd bhj di ab mang rha he anshusharma546
457,Ladke sochte he puri dunia ko muthi me karna he Par rat hote hi unke hath me koch or hota he anshusharma546
458,Thandi ka mosam aa gaya he apni purani setting ko lg na Hiter chahe kaisa bhi ho garm Pori dega anshusharma546
459,Me abhi mat jao dil nahi bhara He bas karr ab nai ho payga anshusharma546
460,Naya naya driver gadi kam chalata he or Horn jayada bajata he anshusharma546
461,Thzcr Hone ka bhi alag dukh h Kabhi bhi mod ban jata he Canshusharma546
462,Pehel ghutnepe bethkar ring dete he Phir ghutne par bethakar Lng_ dete he Canshusharmas46
463,Bhabi pat chillaigi bhi kamm bhi gai Or ager 2 bond gir b to naraz bhi nai hogi anshusharma546
464,Ladko ka sabse pyaara jhut Baby dard nai hone dunga anshusharma546
465,Jab se bh Ka liya he tab seoo Sab ka L_ chota lagne laga he anshusharma546
466,Pehle wo Rose dega Phir wo roz Igao anshusharma546
467,Maza to tab ata h jab bai ke dust pel rhe ho or wo dekhkar hla raha ho 100 anshusharma546
468,Chote bhai ki nunn Mo me lio_ Usne mo me hi mot dia Ganshusharma546
469,Mera cousin bro meri Video dkkr hlta reta h h gys batao kia karo anshusharma546
470,Sunday me dinbhar Chw Phir Monday me freshness aai he 100 anshusharma546
471,Din me didi didi bolta reta he Or rthote hi bw bNa ki Ch_d_ ta he Canshusharma546
472,likal jane ke bad L_ par uchalne wali ladk abhi dhoka nai de sakti 1100 anshusharma546
473,Shadi hone ke bad ap bina kiye kitne din reh Sakte ho Yaha to ek din bhi nai roka jayga anshusharma546
474,Kabi apne bestfriend ko apne mamme ply he anshusharma546
475,Zabhi hua h ek to den aisa gai ho or 2 ko den Pad gai anshusharma546
476,Fngrn ki aadat daldi bhabi ne ab kare bagair raha nai jaata Canshusharma546
477,batana rtme unl Sach anshusharma546
478,Jhut mat bolna tumari eli bar kisne mr Thi Canshusharma546
479,Sks karte samay Ch_ se jayada pn Ata h ya Le se Canshusharma546
480,Choti hight wali lerk ki alag baat he pura halek tak le leti he Canshusharma546
481,Ch_ ka pn Kabhi test kia heoo 100
482,Lrk_ kia tumne kabhi apne L_ ko napa he
483,Kon si side se dCineme jayada maza aata he 1Age 2piche Ganshusharma546
484,Garls fngrn khud karne me maza aata h ya kisi se karbane me Canshusharma546
485,Fngrn ki aadat kisne dali aapko 100 anshusharma546
486,Kis tarha ka L_ jaldi ander nai jata NOY Ganshusharma546
487,Acha suno grl Kabhi bha Ka hath me liye he anshusharma546
488,Shakal adjust kar lenge Lekin L_ perfect chahiye Canshusharma546
489,Cousin bhei se chne ka ek fayda to he kisi ko pata nai chalta Canshusharma546
490,Jhut mat bolna jab Irki ka pani nikltaaa he to wo uchalti kio he anshusharma546
491,Shadi me kisi gerrr mrd se karbaya he kabhi
492,Acha batao cnm gake maza aata h ya bina cn ke anshusharma546
493,Ek lark Kitni der tak L cho sakti he 0O0D anshusharma546
494,kabhi bhai ko Acha batao dekha he hue hilte anshusharma546
495,Orto ke kon se part par msalne se jaldi pni chod deti he
496,Kaise karogi me thand nahi mil raha mujhe le
497,Jhut mat bolna jab pehli bar pni nikla tha to kaisa laga tha U
498,Jhut mat bolna cho marte waqt chocolate ghusai h kbahi
499,Jhut mat bolna patli karki ko chonne mejayada maza aata he ya moti 92
500,Jhut mat bolna ch marne maza aata heya chtne me
501,Jhut mat bolna patli larki ko chonne me maza aata he ya moti
502,m ahate samay cho me sabon ghusaya he
503,Sach sach batana aapne kbhilen_parr conm chadaya he
504,Jhut mat bolna larkio nippl par jibh lagane pagal kio ho jati he
505,Jhut mT bolna larkio ki ch par kab baal ugna shro hote he
506,Kis position me jhatke marne se larkio ki ch me 7 din tak dard rehta he
507,Kia tarha pelne par larkio ka peshab nikal jata he DDO
508,JISAHD aniensh so Aapne farst time kiska In_ dekha tha
509,Topa dalte hi larkia aage kio sarak jati he
510,Jhut mat bolna larkio ko jaldi prgnant krne ka kia treeka he TOY WEM AHMAR
511,Topa dalte hi larkia aage kio sharak jati he
512,Kabhi galti se apne bhai ka In_ dekha he
513,Acha batao ham larkio ko kitne inch ka pasand he
514,Or batao itni thandi me kitne rond lagate ho
515,Garmio me juis or shardio me ch bahut jarori he meri jaan
516,Jhut mat bolna abhi tak kitni bar ln_ le liya ha
517,Larkio ki sl todne ke liye sabse best position kon si he
518,Acha batao meri umar ki larkia kitni der me santosht ho jati he
519,Jhut mat bolna jayada chowane wali larkio ki kia pehchan hoti he
520,Acha batao pehla rond kitne time tak chalna chahiye
521,Sach batana jab pehli bar ander gya tha to moh se kia lafz nikla tha
522,Jhut mat bolna sabse jayada maza kab aata he 1aage 2 piche
523,Larkio ko kab sabse jayada chowane ka mann krta he
524,Kis umar me larkia chone ke liye tarapti he
525,Jhut mat bolna tjmhari oehli bar ch kisne mari thiDD
526,Kia gn_ me phli bar I6n_ dalbane par khon aata he
527,ai me agar ln_ tight na ho to kia karna chahiye
528,Aajkal larko se jayada larkio ko chowane ka shook he
529,bar kiska In Pehli lia tha sach batana
530,Sach sach batana pure kapde utarkr karbane me maza aata h ya aadhe
531,ition to sab best he s bf god me uthakar jab he to baat hi alag ta
532,Baarish or cho ai donu yaadgar rehti he Barish me jism bhigta he or cho ai me jhte
533,bolne Larkia me sharmati itni he verna thand me unhe bhi nind nai aati
534,Sach sach batana sEl tot te time blod nikla tha na
535,Suna he bob ke bich In_ ragadne se teda ln_ bhi sidha ho jata he D
536,shubah uthte hi In_ ko sambhalne walo Good morning
537,Ji mohtarma chatbane me maza aata a h ya ghusbane me
538,Cho ka pni i chehre par lagane e se daag dhabbe khatam ho jate he
539,Cream lagane se nai cream dalbane se nikhaar aata he
540,Larko kia ye bat sach h ki subha subha In_ tunhara khada rehta he
541,Yarr ab to unli karte karte thak gai howo bhi choti lagne lagi
542,Larkio kabhi sokha In_ dalbaya a he
543,Jiju se college ki fees li thi ab 10 din se chddi bhi nai pahenne de rahe he
544,time LAWAI gai l ho ki tni single ho karti ho to type Love ho jata he type Iwda
545,3 Larki apni period date io batati he
546,Sfl kitne bar barbane ke bad tot ti he
547,Aajkal mera bhai aage se kam piche sw jayada bajata he
548,Pani me bethi hui bhess or In_ par bethi hui
549,a Choai me larke jayada der tak kio nai tik paate
550,Kia choai karne se larkia dikhti he sunder
551,8 Sach sach batana kabhi galti se kisi ka In_dekha he
552,Kal bhai meri chaddi ke uper se hi chtne laga me boli aah aah bhai chaddi to utar dem
553,Aapne sabse pehle kiska liya tha mene to apne bhai ka
554,3 aaj bhai ko hilate hue dekh liya ab mera bhi ann karne laga
555,time AII D me larki Kis position tod deti damm apna he
556,Sach scah batana sEEl totte time bld nikla tha na
557,Kia larki bhi sks video dekhti he
558,Kia aapke boyfarnd ka In_ bhi kala I he
559,Kia ln_ ko moh me lena chahiye
560,Kia me aapse apki chaddi ka color r poch sakti ho
561,Kia aapne kisi larke ki yad me unli ki he
562,Bolo larkia gn_ m Iene ke liye kio dar he
563,Ek raat me kitne rond laga sakte ho mere uper koi jhut nai bblega
564,Larkio ki ch kab jayada kali pad jati he
565,Shadi wale din period aa gaye to
566,larke ka 7 anch se ada nai hota kia ye ot sach he
567,karn Chalo bataokiss bad kia karna ke chahiye
568,Sach sach batana pehli br kiska In_ dekha tha
569,Larkia kab kehti h mujhe jor jor se chd
570,Pehli bar sare kapde utarkr kia tha ya sirf salbar niche ki thi
571,Sach sach batana Aapki ch0 ka color kia he
572,Aaj kal larko se jayada chwane ka larkio ko shook ho raha he
573,rhi h kia tum Thand lag kar mujhe garam doge
574,Larkio ko chte samqy gn_ parr thappad kio marte he
575,Aqp nahate samay kia pahnkr nahate ho jhut mat bolna
576,Acha batao aapka kitna lmbal he
577,Agr me apka In_ hila DRe
578,Bina br ke shopping karne gai ho
579,Bina br ke clg ya school gaye ho
580,Ln_ hath me pakadne ke bad kaisa fl hota he mujhe bbhi batao
581,Kitno ke aage gjoci bani ho
582,Acha batao piche se lene me kaisa ffl hota he
583,Oeyy chikne chal apni chaati ka pic bhej
584,Jhut mat bolna abhi tak kitne baar kia he YUTO
585,Sach batana pure kapde utarkr karne me maza aata h ya aadhe kapde me
586,Ki tum mujhe apna lolipop doge
587,Larko tjmhara moh me to le longi par tumhe meri cht n Padegi
588,Bina panty ke relative ke ghar gai ho
589,Larkoo ch marne ka maza condM se aata h ya bina con dm ke
590,Suagrat me har patni apne pati ko kia deti he
591,Apake nippl kis color ke h sach batana
592,Sach sach batana Suagrat ke din kitne rond laganeka socha he
593,harch uthane wale jab uthate he to hisab ng arabar ho jata he
594,Larkia ch_ me kitni unlia unko maza aata he dalti he jisse
595,Kabhi fangaring karte hue ghar me kisi ne pakda he
596,Girlspower aisi honi chahiye to khud bole tum nai loge to me khud de dungi
597,Sirf Larkia bataygi suagrat me sabse pehle dukh kio pilaya jata he
598,Jab Rass ander girta he to larkio ko kaisa lagta he
599,Jis din br sou pahnkr na us din mere dhele pad jate he b bs
600,Khan kia larkia bhi ln ke liye tarapti lene he
601,Kabhi kisi ke sath kapde utar kar soy ho
602,Sach sach batana abhi jss time br pehni h ya nai
603,Aapkj sl kis umar me totiU
604,Fangaring kaha karti ho washroom ya badrooom
605,Kabhi kisi ne jabarjasti chod he
606,batana sach Sach train me kabhit aapke he chua In_ kisi ka
607,Aaj raat bai ne pel ab me kia dia karo
608,Bina bra ke kabbi kisi ki shadi attend ki he
609,Pehli baar sfl totne par kaisa lagta he
610,Kabhi chipp kar kisi k chudt hua dekh GGiy
611,Choti si umar me chudi sikh li ab jab tak 2 In_ na le lo tab tak maza nai aata
612,Mene suna he patle larko ka bahut mota or lamba hota he
613,Har airatt ko acha lagta he ache se sajna or ache se bajna
614,Khan Chalo aaj gandi baat arke pni nikalte he
615,muth marne me Larko aata h ya jayada maza ch
616,Kabhi pichwada me In_ dalbaya he
617,Kabhii video call par ch0 dikhai he
618,Ch par hath ferne parr maza aata he ya ln_ dalbane meU
619,he chakha ka pni Kabhi
620,Acha batao kabbi pora ln_ moh me liya he
621,Kabhi ch par r chati chocolate lagakar eeU
622,bataygi kia Larkia black In_ aapko ha gord h pasand
623,Jhut mat bolna Ek aisi baat batao jisse sabka In_ khada ho jayy
624,Ye pom pom kia hota he
625,DEV Ek hi rond me thaka dunki yakeen nai to try karke dekhlo U
626,Kia Irkia bhi In_ lene ke liye tarapti he
627,Sirf larkai bataygi kia scah me mota In pasand hota he
628,Ek baat pochu ek Agar me tumhari i karo to kia wish pori karbaoge
629,abhi chipp kar kisi ko hodte hue deka he
630,kis ne kahndho par tang rakhkr In lalbayaa he
631,Sachi girlfriend vahi h jo 2 rond pilne ke bad bhi yahi bole ki babu panty pehno ya or karoge
632,ach batao larkia dalbane ke me kio nai Iwti bad
633,Larke jab moth marte h to kia girta he
634,kaha par mutti ho e room 5
635,Apko kon si tablet pasand he
636,Wo pagal mera number mang raha tha mene kaha Rs5oo dede pora sim hilezae
637,Ek hi rond me thaka lungi yakeen nai to try arkedekhlo
638,rko me kese pata ki ye virgin he lega
639,Sach batao apki gulabi h ya kali
640,Kon si 2 position larki ko bahut pasand hoti he
641,Yarr chochiya moti ho rahi h patli kaise karo
642,jab qtana pehli nder gya tha to se pela lafz tha
643,Acha batao dalte time ko jhatka l larkio kio lagta he
644,ra foom wali pehli ho cotton wali
645,ach sach batana sks karte samay ch se ani kio aata he
646,ia aap mere sath bina phone ke pori life reh sakte ho
647,Kia savh me pura ln ander ja sakta he50
648,04 Sach batana tumhara bhi night fall hota he kia
649,SEI pack larki kaha milti h gao me ya sher me GC
650,8 batao larko ch ke darshan hue ki nai
651,bhi apni bestfriend ke sath ghapa ghap kic he
652,Har aaourat ko acha lagta ha ache se sajna or ache se bajna
653,batao kia khane dko pori raat nai thakte
654,patt jao To sabse gar me le kia karogeoo
655,Larkia In_Lete samay Aankhe band l kio Kar Leti he
656,Larkio kabhi sokha Dalbaya he DD 7
657,Acha batao kbiOy me le Jaker pela he
658,mat t bolnd itniBar kia he
659,Acha batao kia tum bi Chodn se pehle Ln_ ko Moh me leti ho
660,IE1E Ek hi round me Thaka dungi fakeen nai h to Try karke Dekhlo
661,Yarr pom pom bade Karne he
662,Chalo bataoa chMarne Me jada maza ata h Ya Gn_
663,Acha batao aapka In Kitne der tak Khada reta he
664,Acha batao larko ko Seks Ke liye kese Manay
665,hath me lekr Kesa n Lagta h mujhe biBatao
666,kitni Derr Imara ni nikalta he onni
667,Jhut mat bolna Larkia chaddi kio pehnti HeDD
668,Jab aapa peli bar Pani Nikla tha to kesa Laga ThaoDD
669,Sach batana In Chusne Ke bad kesa Feel hota he
670,Apki sl kisne Thodi Or wo apka kia Lagta He
671,Chalo batao ch0 par kia Lagake ChtogE
672,Larko batao gn_ Marne Me maza ata he ya Ch
673,Sach sach batana Ch0 me kon Sa aungli Dalte ho
674,Unli se kab takKam chlao Ye bi ab choti Lagne lagi
675,ach batana Kavi wo ali video Deki he BAIC
676,angaring ki aadt Kisne Dali aapko
677,Gn_me ln_Na jay To kia kare
678,Jhut mat bolna keaa In_ Pasand pko He 1 Lmba 2mta
679,Nahate samay Sabon Ko Kbi ch0 Me ghusya He
680,Full night me Kitne rond Kar sakte hoo
681,batao sach Sach In_ Dalbane ke bad arkia Kio nai t Chus
682,Larki ko kaha chune par Unka chutwane Ka mann Karta he
683,Saac batana Kia apne Kbi Apni gf ki ChMe ml girya de
684,ka arko ka seks Karne Mann Kab krta he
685,mujhe Apne In_Ka ap bhej sakte ho oto
686,lagane Se In on sa Tel Der tak Khada raita he
687,Apki seel Todne me Kiska Hath heKoi jhut naiBolego
688,EMERGENCY EXIT kon Hath se Kam Chala ha he
689,Chalo ye batao Larkia Chaddi kio penti he
690,Akr pora Dal dia
691,takya ke Niche Lamar kia se Chodn Lagake Hota he
692,Fangaring ki Aadat Kisne Dali apko Sach sach batana
693,Kbi Ln Ka jyja Liya h
694,Kiss Kaha Par krne Me maza Ata hee
695,batao Lrki ke jhrne Ka cha se pta Lgta he U
696,Aisi Kon Si chiz H jo Hath Lagate Hi khadi Jo jati hoo
697,a batao Kbhi kisiLrkike I Pr kataH
698,apne Ln Kbi Kisi Larki Ko 11 Par betaya he
699,Kbi Larki Ki gn Par thok Kr Apna Ln Dala h
700,Ko IOr chusne Me arkio Sharm kio ati he
701,Bar Sach sach batana Last Ghpa ghp Kb kiya Tha
702,nie Yd68 Garrls Ln Dekker Sharmat Kio he
703,Kbi Kisi Larki Sacch batanaa Ki ch0 Me se BlOd Nikalaa He
704,Shadi ke bad Larki Ki g doti ko Ho jati he ign
705,Apne kabhiNiche Bale Sman ki kiss Ki he
706,Kbi aadhi raat Uthkar cousin Ko pela he e
707,Sach sach batana Larkio tumara Kitni der Me Pni nikalta He
708,Mene aaj tak Thook Lgakr Ni dalbaya Or apne
709,Kbi apne bestfriend Ko Chor Bankr r chd he
710,h batana hi In Chta he
711,Kisi larke ko dekkar Kese Pata kre Seel pake he
712,Pela round kitne Tame Tak Chaln chHiye
713,Acha batao Larkia pntiii Kio Pehnnti He sartah by or
714,jut bolkar KabiSe me char ho gaye Milne
715,Kia larkia a apne boobs khud Dabati he
716,Jhatke dnee par Maza Ata h Ya aram se
717,cha batao hla roond kitni time Tak halna chahiye
718,Sach batana kabhi Kheera Use ki Tumne He APr 22 2022
719,Ch me jada drd Hota h Ya gn me Megaoon
720,larkio Sonu kia ap bi godi me Uthkar ChoD ho APr 22 2022
721,Q for boys larki ke M Kbhi kisi UMe Jhda he
722,Kia apne Irki ke hoto Parr n ka toopaFera he
723,rka aisa patao jo Disprinn ii pill lene ka reasonBane
724,larko Sonu A hame pyar KarneWala 1odi banne Wla chahi
725,Q for garls pora ander Jata He to Jab Kasa Ita hasy
726,Jis trhe larko ka subah Khra ho Jata hekia larkio ko bi Koch hota He
727,jut ni bolna orne se pele Usko Cht te U
728,XART o kabhi niche Chocolate Lrkio Lagkr chtvaya he
729,Jiska kla or naso wala In ho plz jaror bty
730,bi boyfriend ne ch Ke glt pol me dala h
731,Apki seel Kaha toti Ghr Hostel Oyo College Jungle
732,Mard orat Ki C T Ke liye Koch bhi kar sakte ha
733,ahate Samay kabhi sabon pni choo m Ghusaya he
734,pni gf Samjhkar Koch bi Bolkr jao
735,Garls batao ari kon si chiz Kali he
736,pki seel kis age Me tt yi thi
737,aaj sb Apni ch Chalo or Ln ka Color batao
738,Ye question larki ke lie ia tum Bhi pon Dekhti ho
739,Kia aapne Kbi Bob Par Chocolate lagakar Chusbay he
740,avi Dogy style Me mrvai he Jhut nai bolna
741,pke duddu Kisne Bade kiye bot ni bolnA
742,garl batao Or Nightfall me Kabbi apne he Iua
743,Agar chtne Ka moka Du to Kaha chatge Aage Piche
744,Aapke sath Tapa tp he Karna Bol nai sakti Bol nai sakti Isi liye reel Bna diii
745,Kya sab Lrko Ka Id Teda Hi hta he
746,Chalo batao oni gufaaa Me Aaj tek Kyia ea Dalw ho K
747,Kabhi apneBestfriend Garls Mari he Ki mothi 00
748,Aaj bf Ne galat Hool me Dal Diya
749,21 saaal ki ho gaiHo parrr Abbi tak Na kia
750,WE ARE CHANGING Kia tum Mujhe Apna Id DikhageeeTv
751,Sachiii batana Choo kali Hoti he Ya gulabi
752,Or batao Hilane se Se kia Sachmee Badaa hota he
753,Or batao Raat Ko kia Paahen Kar sote ho
754,Kabhi kisi Ladki ke Pom pom Dabaaay he
755,Kia Aap bhi Pron Dekhte ho
756,Or batao Raat ko Mood banta He to Kia karte hoc
757,Yarr Bhai ne Aaj bina Kapdo Ke dekh liaaaa eo
758,Jab aapka Mood Banta heto Kia karti ho
759,Tumne kabhi Live Chuai Dekhi he
760,ke Or batao Ladko Choo Darshan Hue he kabhi 46 2E Typing
761,Pehle round Kitni Der tak halna chahiye 0T Typing
762,He jiske Aisi kia Chiz uper ladkia Uchalna Bethkar he Karti Pasand Typing
763,time adkia Lan Lete Kio kar Leti he Aankh band Typing
